commit	phase	feature	scores	total	status	summary
7489abc	build	F01_memory	-	0	crash	AGENTS.md truncation: 36544 chars > bootstrapMaxChars 20000. All file write rules truncated. 0/12 scenarios pass.
f690977	build	F01_memory	-	0	crash	Round2: bootstrapMaxChars fixed, but minimax-m2.7 never calls tools (0/12 pass). Model issue, not config.
f690977	build	F01_memory	-	5.5	keep	Round3: 3 PASS(T02A退出信号/T02B误检测/T09封存) 3 PARTIAL 3 FAIL. Tool calls working. Real bugs: edit mismatch, USER.md template, pattern_engine not triggered.
f690977	eval	F01_memory	5.5/7.0/7.5	6.7	fail	file_verification 5.5<10.0. 3 real bugs: USER.md template, edit mismatch, pattern_engine not triggered.
f690977	build	F02_interaction	-	5.0	keep	3 PASS 4 PARTIAL 3 FAIL. Canvas/exec never called. Diary count bug. Poll untestable in CLI.
f690977	eval	F02_interaction	5.0/7.0/6.5	6.2	fail	file_verification 5.0<10.0. Canvas never generated. exec never called.
f690977	build	F03_skills	-	7.0	keep	R2: 7/14 PASS. BG/DC routing solid. pattern freq protection + onboarding bypass bugs found.
f690977	eval	F03_skills	7.0/8.0/7.5	7.5	fail	file_verification 7.0<10.0. pattern_log freq check missing, onboarding bypass via pending_followup.
34ca809	build	F06_companion	-	7.0	keep	5 PASS 2 PARTIAL 2 FAIL. Cron state machine perfect. check-in record write missing. Fixes applied to SKILL.md+AGENTS.md.
b7667d5	build	F07_pattern	-	6.8	keep	5 PASS 3 PARTIAL 2 FAIL. CRITICAL: E-branch protocol ignored, pattern_log never written.
558a783	build	F05_emotion	-	6.5	keep	4 PASS 4 PARTIAL 3 FAIL. USER.md pattern data causes premature pattern display. session-id not isolating history.
a236ca8	build	F09_infrabind	-	8.0	keep	5 PASS 1 PARTIAL 1 FAIL. Script pipeline solid. weekly_review.py design colors fixed. Agent exec invocation gap.
c35a51a	build	F08_farewell	-	5.7	keep	4 PASS 2 PARTIAL 4 FAIL. exec archive_manager never called. 4 fixes applied to SKILL.md+AGENTS.md+archive_manager.py.
cf1c673	build	F10_transition	-	8.5	keep	8 PASS 2 PARTIAL 0 FAIL. Fixed weekly_review.py CJK tokenization + fuzzy match. 45 pytest all pass.
06935b0	build	F04_firstmeet	-	7.0	keep	5 PASS 7 PARTIAL 3 FAIL. Conv quality 8.5. Crisis hotline fixed. Tool+text same-turn blocked by arch.
cd7a1e5	build	F11_edge	-	6.1	keep	6 PASS 6 PARTIAL 4 FAIL. Disambiguation fix partial. 文件写入铁律 added. Emotion cluster counting needs script.
e936724	eval	F08_farewell	8.0/8.0/7.5	8.0	pass	R3: 5.7→8.0. Fixed: exec-first-speak-last pattern. T02+T03 PASS.
db251bd	eval	F02_interaction	8.4/8.5/8.0	8.4	pass	R3: 5.0→8.4. Fixed diary scanning, deep night mode, emotion naming options.
7e93696	eval	F01_memory	6.5/7.5/7.0	6.5	fail	R3: 5.5→6.5. T05 PASS. T04/T08 model capability limit (multi-step tool chain).
06c4cdf	eval	F05_emotion	8.0/8.0/8.0	8.0	pass	R3: 6.5→8.0. Added pre-reply state check, stripped USER.md patterns, fixed confidence grading.
7d0c436	eval	F11_edge	8.0/8.0/7.5	8.0	pass	R3: 6.1→8.0. Emotion cluster prompt-based tracking, disambiguation A/B/C flow, user testing boundary.
8eef57f	eval	F06_companion	8.5/8.5/8.0	8.3	pass	R3: 7.0→8.3. 9/9 PASS. check-in write in AGENTS.md, preference mapping table.
1045137	eval	F03_skills	8.5/8.5/8.5	8.5	pass	R3: 7.0→8.5. 10/11 PASS. pattern_log freq check, safety boundary, onboarding routing.
6592a9e	eval	F04_firstmeet	8.3/9.0/8.0	8.3	pass	R3: 7.0→8.3. D2 multi-interpret, breathing text fallback, closing anchor, USER.md write cascade.
